keys,format,vi,en
@INTRO_SEQUENCE_TEXT,,"Vào một ngày yên bình ở hành tinh Doggo


Loài Mèo từ một hành tinh xa xôi
Đã đến xâm chiếm mảnh đất này không báo trước.


Chúng đến với một quân đoàn hùng mạnh,
Với số lượng không thể tưởng tượng được

Loài Chó, cùng đường, phải rút chạy về
Nơi phòng thủ cuối cùng: Căn Cứ Chó


Một vùng đất nằm trên mây,
An toàn khỏi tầm kiểm soát của bọn Mèo
Ít nhất là bây giờ...


...Đến giờ ăn trưa rồi à?
Ok.













...Ngon ghê, à nói tới đâu rồi nhỉ?
Sau một khoảng thời gian chuẩn bị và suy nghĩ
Loài Chó quyết định:

PHẢN CÔNG!!!

Nhằm giành lại chủ quyền, độc lập cho loài Chó.

Và vì bọn tôi cũng ghét bọn Mèo,
Bọn chúng gọi bản thân là ""The Battle Cats""

Vậy thì, bọn tôi cũng sẽ xin gọi đội quân chúng tôi là:

THE BATTLE DOGS



Nghe cũng không tệ chứ nhỉ?

Chuyện chỉ có vậy thôi.","It was a peaceful day on planet Doggo


The Catkind from a faraway planet
Had come and invade this land with no forewarning.


They had come with a powerful army,
With unimaginable number of soilders

The Dogkind, in desperation, had to retreat
To their last defensive area: The Dog Base


An island above the clouds,
Safe from the reach of the Cats
At least for now...


...Oh, It's lunch time?
Ok.













...Delicious, ah where was I?
After giving some preparations and deep thoughts
We Dogs have decided:

TO FIGHT BACK!!!

To take back our sovereignty and independence to the Dogkind.

And also because we really hate Cats,
They called themselves ""The Battle Cats""

Then, we would also like to call ourselves:

THE BATTLE DOGS



Doesn't sound too bad, eh?

That's pretty much it."
@ENDING_SEQUENCE_TEXT,,"Và thế là Đội quân The Battle Dogs
Cùng với sự chỉ huy tài tình của bạn

Sau nhiều tháng đấu tranh quyết liệt
Loài Chó, với sự tàn vong của Chúa Mèo, cuối cùng đã đánh đuổi được loài Mèo
Ra khỏi hành tinh Doggo

Hành tinh Doggo đã giành được độc lập
Nhờ ơn Bạn!!

Cảm ơn!
...


Huh... Hơi ngại một chút nhưng, ...



Bạn tên gì ấy nhỉ?

Xin lỗi!  Xin lỗi!  Xin lỗi!!!
Do ban đầu chúng tôi lo việc chiến tranh đánh với bọn Mèo nên bọn tôi quên mất không hỏi tên mà chỉ gọi bạn là Con Người... vài tuần sau thì lâu quá rồi nên bọn tôi cũng không dám hỏi tên, cứ gọi bằng biệt danh như Sếp, Boss Man, Chó Không Lông... Giờ thì mọi thứ yên bình rồi nên mới dám hỏi tên. Hãy tha thứ cho sự ngu muội của chúng tôi, loài Chó bọn tôi thật sự nợ bạn cả đất nước này!!!!

...

Ồ... Nó không có gì to tát à? Xin lỗi!!!
Bọn Chó chúng tôi rất ghét làm cho người khác phiền lòng nên hay giải thích cho người khác hiểu hiểu hành động của chúng tôi, rất xin lỗi, xin lỗi! Làm ơn hãy tha-

...

À, đúng rồi. Nói đến đâu rồi nhỉ?

Mặc dù hành tinh này đã bình yên trở lại, 
Nhưng sự kiện này đã nảy ra một câu hỏi trong óc Chó bọn tôi:

Các hành tinh khác thì sau?

Biết bao nhiêu hành tinh khác đã bị loài Mèo xâm chiếm?
Và loài Chó chúng tôi cảm thấy đây là một điều
Không
Thể
Chấp
Nhận
Được.

Nên... Trong tương lai, sau khi mọi thứ đã ổn định
The Battle Dogs
Sẽ tiếp tục cuộc viễn chinh

TIÊU DIỆT LOÀI MÈO!

... Hả?
Bạn thích Mèo à?

Nhưng... Nhưng....


Cái gì?

Bọn Mèo đó... đến từ Trái Đất?
Hành tinh của bạn?

...




*Loài Chó không biết nên nghĩ sau về điều này*



Thế thì...

PHẢI TIÊU DIỆT LOÀI MÈO!

GIẢI THOÁT CHO CON NGƯỜI!!

ĐÚNG VẬY!

GIẢI THOÁT CHO BẠN...



...Bạn tên gì ấy nhỉ?











THE END

CẢM ƠN VÌ ĐÃ CHƠI GAME!","And so, The Battle Dogs
With your excellent leadership

After many months of hardship, endless fighting
The Dogkind, with the death of Cat God, finally managed to expel the Catkind
Out of planet Doggo

Planet Doggo has taken back it's independence
We are indebted to You!!

Thank you!
...


Huh... This is a little embarrassing, but...



What is your name?

Sorry!  Sorry!  So Sorry!!!
We were too occupied with doing wars with the Cats at the beginning that we forgot to ask for your name and just call you Human... And after a few weeks it's been so long now to ask you for your name so we just not doing it, instead we call you by other titles like Captain, Boss Man, Hairless Dog... Now that everything is peaceful and good we thought it would be a great occasion to ask for your name. Please forgive our foolishness, we Dogkind really are indebted to You!!!!
...

Oh... It's no big deal? So sorry!!!
We Dogs really hate to make others disappointed so we always try to clarify our actions, sorry if it bother you, so sorry! Please forgi-

...

Ah, right, right. Where was I?

Although our planet is now peaceful again,
But this event has planted a seed, a question to our no thoughts empty heads:

What about other planets?

How many other planets have been invaded by the Catkind?
And our Dogkind feel like this is something


UNFORGIVABLE.



So... In the future, after everything is back to normal again
The Battle Dogs
Will continue their expedition

TO DEMOLISH THE CATKIND!

... What?
But you like Cats?

But... But....


What?

Those Cats... They come from Earth?
Your Planet?

...




*The Dogs don't know how to feel about this*



Then...

WE HAVE TO DESTROY THE CATS!

AND LIBERATE THE HOOMAN!!

THAT'S RIGHT!

TO SAVE YOU...



...What's your name?











THE END

THANK YOU FOR PLAYING!"
@TUTORIAL_INTRO_1,,"Xin chào, ta lại gặp nhau một lần nữa.","Hey there, we meet again."
@TUTORIAL_INTRO_2,,Vì bạn là người mới ở đây nên hãy để tôi giải thích một số vấn đề.,"Since you are new here, let me clue you in for a bit."
@TUTORIAL_INTRO_3,,"Nhiệm vụ của bạn là [hi]bảo vệ Thành Chó[/hi], [hi]tiêu diệt kẻ địch và phá hủy thành trì của bọn chúng[/hi].","Your mission is to [hi]protect the Dog Tower[/hi], [hi]eliminate the enemies and destroy their fortress[/hi]."
@TUTORIAL_INTRO_4,,"Để làm được điều này, chúng ta cần [hi]quân lính[/hi] tấn công trên mặt trận [jump](chính là bọn Chó chúng tôi!)[/jump]","To accomplish this, we would need [hi]soldiers[/hi] fighting on the battlefield [jump](that's where us Dogs come into play!)[/jump]"
@TUTORIAL_INTRO_5,,"Bạn có thể triệu hồi chúng tôi bằng cách [hi]nhấp chuột vào các ô có hình Chó[/hi] ở trên đây. Hiện tại chỉ có một loại Chó để triệu hồi nhưng đừng lo, bạn có thể mở khóa các loại Chó khác tại khu vực [hi]Nâng Cấp[/hi] ở Căn cứ Chó.","You can summon us by [hi]pressing on the boxes with Dog icons[/hi] up here. Right now you only have one Dog type to summon but don't worry, you can unlock different types of Dogs in the [hi]Upgrade[/hi] area in the Dogbase later."
@TUTORIAL_INTRO_6,,"Bạn cần có đủ [hi c=yellow]tiền[/hi] để triệu hồi Chó, [hi]tiền được tăng theo thời gian[/hi] nên bạn chỉ cần đợi một lát là sẽ có đủ tiền để triệu hồi Chó ngay!","You need to have enough [hi c=yellow]money[/hi] to summon Dogs, [hi]money will increase gradually overtime[/hi] so you just have to wait until you have enough money and then you can summon us!"
@TUTORIAL_INTRO_7,,"Nào, bạn hãy thử gọi một chú Chó ra thử xem! [jump](Bấm vào ô có hình Chó khi có đủ tiền)[/jump]","Now, try to summon a Dog! [jump](Press on the available box when you have enough money)[/jump]"
@TUTORIAL_DOG_SPAWN_1,,"[jump]Hay quá[/jump], giờ ta đã có [hi]Chó[/hi] để bảo vệ [hi]Thành Chó[/hi] thiêng liêng của chúng tôi rồi!","[jump]Very nice[/jump], now we have a [hi]Dog[/hi] to protect our sacred [hi]Dog Tower[/hi]!"
@TUTORIAL_DOG_SPAWN_2,,Mỗi ô triệu hồi sẽ cần một khoảng [hi]thời gian chờ[/hi] để chuẩn bị Chó mới sau khi triệu hồi xong. Thời gian chờ nhanh hay chậm tùy thuộc vào [hi]loại Chó[/hi] nằm trong ô triệu hồi đó.,Every summon box will goes into a [hi]cooldown[/hi] period after summoning to prepare a new Dog. This preparation time is depending on the [hi]type of Dog[/hi] the summon box contains.
@TUTORIAL_DOG_SPAWN_3,,"Ok, Giờ tôi xin hướng dẫn bạn thêm thêm về một số tính năng khác trong trận đấu!","Ok, now, allow me to explain a bit more about the other features that you can use inside the battlefield!"
@TUTORIAL_DOG_SPAWN_4,,Bạn có thể nâng cấp [hi]năng suất tạo tiền theo thời gian[/hi] cũng như [hi c=yellow]số tiền tối đa chứa được[/hi] bằng cách nhấn vào nút này. Bạn chỉ có thể nâng cấp khi có đủ số tiền ghi ở trên nút.,You can upgrade the [hi]money generation efficiency[/hi] as well as the [hi c=yellow]maximum amount of money you can hold[/hi] by pressing this button. You can only upgrade it once you have enough money written on the button.
@TUTORIAL_DOG_SPAWN_5,,"Đây là [hi]nút đổi hàng triệu hồi Chó[/hi], hiện tại ta chỉ có một loại Chó nên nút này không cần thiết cho lắm, nhưng về sau khi bạn có nhiều Chó hơn nó sẽ trở nên hữu dụng.",This is the [hi]switch summon boxes button[/hi]. Right now it is pretty useless but later on after you have recruited more Dogs this will provide more useful.
@TUTORIAL_DOG_SPAWN_6,,Tiếp theo là các [hi]nút kỹ năng[/hi]. Kỹ năng cho phép bạn hỗ trợ loài Chó chúng tôi bằng [hi]hành động đặc biệt tác động lên trận đấu[/hi].,Next up is the [hi]skill buttons[/hi]. Skills allow you to support our Dogkind by performing a certain [hi]special action affecting the battlefield[/hi].
@TUTORIAL_DOG_SPAWN_7,,"Kỹ năng [hi]không tốn tiền để sử dụng[/hi], khá là tuyệt nhỉ? Mặc dù thời gian hồi kỹ năng khá là lâu. Hãy dùng nó khi cần thiết!","Skills [hi]do not require money to use[/hi], pretty neat eh? Although the recharge time is pretty long. Use them when you see fit!"
@TUTORIAL_DOG_SPAWN_8,,"Trong một số trường hợp bạn muốn [hi]thời gian trôi qua nhanh hơn[/hi], bạn có thể bấm nút này. Bấm lại nút một lần nữa sẽ biến thời gian trôi lại như bình thường.","In some cases you might want to [hi]speed up the actions inside the battlefield[/hi], you can do so with this button. Pressing the same button again will turn the speed back to normal."
@TUTORIAL_DOG_SPAWN_9,,Một tính năng khá quan trọng trong trận đấu chính là [hi]tầm nhìn![/hi] Bạn có thể dùng các nút này để [hi]di chuyển và phóng to/thu nhỏ tầm nhìn[/hi]. [jump](Hoặc bạn có thể dùng các phím mũi tên trên bàn phím!)[/jump],"Another pretty important feature is [hi]vision![/hi] Use these buttons to [hi]move and zoom in/zoom out what you can see[/hi]. [jump](Or, you can just use the arrow keys on the keyboard!)[/jump]"
@TUTORIAL_DOG_SPAWN_10,,"[jump]Nói mới nhớ![/jump] Tất cả các tính năng mà tôi đã nói từ nảy giờ [hi]đều có phím tắt riêng trên bàn phím![/hi] Bạn có thể xem nó là nút gì bằng cách [hi]hơ chuột vào nút muốn xem[/hi]. Ngoài ra, nếu muốn, bạn có thể vào mục [hi]Cài đặt[/hi] để tùy chỉnh phím tắt sao cho phù hợp với mình","[jump]I almost forgot![/jump] All of the features I just talked about all have their own respective shortcut keys on the keyboard. you can check what key it is by [hi]hovering on the button of a feature you want to check[/hi]. And if you want, you can change those keys to be ones that you find comfortable in the [hi]Settings menu[/hi]."
@TUTORIAL_DOG_SPAWN_11,,"Và cuối cùng, bạn có thể [hi]tạm dừng trận đấu[/hi] bằng nút này.","And lastly, you can [hi]pause the game[/hi] using this button."
@TUTORIAL_DOG_SPAWN_12,,"[wave]Phù...[/wave] Ok, giải thích nhiêu đó đủ rồi, [jump]hãy tiêu diệt kẻ địch và giành lại vùng đất Chó của bọn tôi thôi!!![/jump]","[wave]Phew...[/wave] Ok, that's enough explaining, [jump]let's destroy the enemies and took back our Doggo land!!![/jump]"
@TUTORIAL_DOG_SPAWN_13,,Hả? Kẻ địch là ai ư?,What? Who are the enemies? 
@TUTORIAL_DOG_SPAWN_14,,"[hi c=red][wave]Bọn chúng là những con vật cực kỳ xảo quyệt và kinh tởm,[/wave][/hi]","[hi c=red][wave]They are devilish and vile creatures, [/wave][/hi]"
@TUTORIAL_DOG_SPAWN_15,,"[hi c=red][shake]Bọn Ch- Ôi trời ơi, bọn chúng kìa!!!![/shake][/hi]",[hi c=red][shake]The- Oh god they're here!!!![/shake][/hi]
@TUTORIAL_CAT_SPAWN_1,,[hi c=red]...Loài Mèo.[/hi],[hi c=red]...The Catkind.[/hi]
@TUTORIAL_CAT_SPAWN_2,,"Khi tiêu diệt được một con [hi c=red]Mèo[/hi], bạn sẽ được [hi c=yellow]thưởng một lượng tiền nhất định.[/hi]","When you kill a [hi c=red]Cat[/hi], you will be [hi]rewarded a certain amount of money[/hi]."
@TUTORIAL_CAT_SPAWN_3,,"[jump]Càng có thêm lí do để tiêu diệt bọn Mèo!![/jump] Nào, hãy sử dụng những kiến thức vừa học được để tiêu diệt bọn chúng và phá hủy Thành Mèo tà đạo mà bọn chúng xây dựng thôi!!!","[jump]All the more reasons to get rid of those Cats!![/jump] Now, utilize the knowledge that you have learned to destroy them and their pagan Cat Towers!!!"
@TUTORIAL_CAT_TOWER_DAMAGED_1,,"[jump]Hay lắm[/jump], đã đến lúc công phá thành rồi! Đây là [hi c=red]Thành Mèo[/hi], [wave]một khi [hi]máu của Thành Mèo trở về 0[/hi] thì chúng ta thắng![/wave]","[jump]Nicely done[/jump], time to destroy the tower! This is the [hi c=red]Cat Tower[/hi], [wave]we win once the [hi]tower's health drops to 0[/hi]![/wave]"
@TUTORIAL_WON_1,,[jump]Hay quá!!! Chúng ta thắng rồi![/jump],[jump]Awww Yeah!!! We Won![/jump]
@TUTORIAL_WON_2,,Cảm ơn bạn đã chỉ huy chúng tôi một cách tài tình! ,Thank you for leading us to victory masterfully!
@TUTORIAL_WON_3,,"Nhưng hãy nhớ rằng: sẽ còn nhiều bất ngờ xảy ra ở các vùng đất khác mà bọn Mèo chiếm đóng, cho nên hãy cẩn thận. Bây giờ hãy ăn mừng thôi hehe!","But remember: there are many surprises ahead in lands that are captured by those Cats, therefore be careful. Now let's celebrate our victory hehe!"
@TUTORIAL_LOST_ONCE_1,,...,...
@TUTORIAL_LOST_ONCE_2,,"Thôi không sao, thua keo này ta bày keo khác. Chúng ta sẽ tiêu diệt bọn chúng ở đợt sau.","That's okay, we can start again. We'll get them next time."
@TUTORIAL_LOST_TWICE_1,,...,...
@TUTORIAL_LOST_TWICE_2,,"Hmmm, có khi nào khả năng hướng dẫn của tôi còn quá kém. Ngôn ngữ con người khó sử dụng quá đi.","Hmmm, maybe my explaining skill is still quite poor. Human language is pretty hard to use. "
@TUTORIAL_LOST_TWICE_3,,"Được rồi, tôi sẽ hướng dẫn lại cho bạn một lần nữa ở lần sau.","Alright, I'll explain it again for you next time."
@TUTORIAL_LOST_THRICE_1,,...,...
@TUTORIAL_LOST_THRICE_2,,"[jump]Này!!![/jump] [shake]Bạn có nghe tôi hướng dẫn khi nảy không đấy???[/shake] Bạn chỉ việc đợi tiền tăng lên rồi gọi Chó ra là sẽ thắng mà, có gì khó đâu???","[jump]Hey!!![/jump] [shake]Did you even listen to what I was saying earlier???[/shake] All you gotta do was waiting for money to goes up and called up those Dogs and then you won, what's so hard about that???"
@TUTORIAL_LOST_THRICE_3,,[wave]Được rồi. Bình tĩnh nào...[/wave] Thử lại.,[wave]Alright... Calm down...[/wave] Again.
@TUTORIAL_LOST_THRICE_4,,"Ta thử lại một lần nữa nha, tôi cũng sẽ hướng dẫn cho bạn một lần nữa... Bạn hãy nhớ chú ý vào. ","Let's try again ok buddy, I will also try to explain to you again... Please pay attention."
@TUTORIAL_LOST_THRICE_5,,"Bạn chỉ việc đợi tiền lên và gọi Chó, ắc sẽ thắng, cứ làm vậy là được. Nào, cùng đánh chiếm lại vùng đất này nào.","You just have to wait until you have enough money and summon the Dogs, then you will win, just do that and you will be okay. Now, let's capture this land again."
@TUTORIAL_KILL_1,,[shake]THẬT KHÔNG THỂ TIN ĐƯỢC!!!![/shake],[shake]UNBELIEVABLE!!![/shake]
@TUTORIAL_KILL_2,,"[shake]Ngân sách Chó của chúng tôi có hạn, không thể nào trao quyền chỉ huy cho một người như thế này được![/shake]","[shake]Our Dog resources are not unlimited, we absolutely can not let some one like this guy to lead us![/shake]"
@TUTORIAL_KILL_3,,[shake][hi c=red]Tại sao??? Lí do gì mà Người lại để bọn Chó chúng tôi 4 lần liên tiếp phải thất bại. Bao nhiêu chú Chó đã hi sinh trên chiến trường? HỌ CHẾT VÌ LÍ DO GÌ ĐÂY???[/hi][/shake],[hi c=red][shake]Why??? For what reason that You have to let us Dogkind 4 times in a row face defeat. How many Dogs has died on the battlefield? AND FOR WHAT REASON DID THEY DIED???[/shake][/hi]
@TUTORIAL_KILL_4,,Có khi nào... [hi c=red][shake]Có khi nào ngươi!!![/shake] [wave]Ngươi là gián điệp được bọn Mèo gửi qua đây để làm phá hỏng kế hoạch của bọn Chó ta?[/wave][/hi],Could it be that... [hi=cred][shake]that You!!![/shake] [wave]You must be a spy that the Catkind sent here to sabotage our plan![/wave][/hi]
@TUTORIAL_KILL_5,,[hi c=red]Được lắm... [shake]CHẾT!!![/shake][/hi],[hi c=red]Right... [shake]DIE!!![/shake][/hi]
@BAD_ENDING,,"Và thế là bạn đã bị thủ tiêu và thay thế bởi một sinh vật khác...


BAD ENDING.","And so you were disposed of and replaced by another being...


BAD ENDING."
@BAD_ENDING_DOG_OBTAINED,,Một sự hiện diện đáng kinh hoàng đã được giáng xuống thế giới này.,A terrifying presence has entered this world.
@TUTORIAL_TEAM_SETUP_BUTTON_1,,"Hay lắm, nhờ bạn mà giờ đây sức mạnh của loài chúng tôi đã tăng lên đáng kể hơn trước.","Nice, thanks to you our power has increased significantly."
@TUTORIAL_TEAM_SETUP_BUTTON_2,,Bạn hãy bấm vào nút [hi]Thiết lập đội hình[/hi] để thêm Chó hoặc kỹ năng mới mở khóa của bạn vào đội hình của mình.,Press the [hi]Team setup[/hi] button to add Dogs or Skills that you have unlocked into your team.
@TUTORIAL_TEAM_SETUP_1,,"Đây là nơi thiết lập đội hình, bạn có thể quản lý [hi]Chó[/hi] và [hi]kỹ năng[/hi] vào đội hình hiện tại sao cho phù hợp với lối chơi của bạn.","This is the team setup area, you can incorporate [hi]Dogs[/hi] and [hi]Skills[/hi] into a team that suits your playstyle."
@TUTORIAL_TEAM_SETUP_2,,"Một khi đã thiết lập đội hình xong, bạn có thể bấm [hi]Quay lại[/hi] để trở lại [hi]Bản đồ Thế giới[/hi]. Đội hình sẽ được lưu lại tự động.",After you have finished the team setup. you can press the [hi]Go back[/hi] button to go back to the [hi]World Map[/hi]. Team setup will be saved automatically.
@TUTORIAL_DOGBASE_1,,Hé lô! Chào mừng đến căn cứ Chó của bọn tôi. Hãy bấm vào nút [hi]Viễn chinh[/hi] để bắt đầu hành trình giành lại lãnh thổ của hành tinh Doggo đang bị kẻ địch chiếm đóng.,Hi there! Welcome to our Dogbase. Please press the [hi]Expedition[/hi] button to start our journey taking back our homeland which has been invaded by the enemy.
@TUTORIAL_DOGBASE_AFTER_BATTLEFIELD_1,,Nhìn số lượng Xương mà bạn thu thập được sau trận đấu kìa! Hãy bấm nút [hi]Nâng cấp[/hi] để tiêu xài Xương nào.,Look at those Bones that you have collected after battle! Let's press the [hi]Upgrade[/hi] to spend them.
@TUTORIAL_UPGRADE_1,,Chào mừng đến với khu vực nâng cấp! Đây là nơi để bạn [hi]mở khóa và nâng cấp[/hi] nhứng chú Chó yêu quý cũng như Kỹ năng hay Nội tại trong trận đấu.,Welcome to the upgrade area! this is where you can [hi]unlock and upgrade[/hi] those precious Dogs as well as Skills or Passives.
@TUTORIAL_UPGRADE_2,,Hãy đọc phần [hi]Thông tin[/hi] để biết thêm về thứ mà bạn có ý định mở khóa/nâng cấp.,Read the [hi]Information[/hi] section to know more about what you are going to unlock/upgrade.
@TUTORIAL_BOSS_1,,Đây là vũ khí bí mật của loài Mèo... [hi c=red]Trùm Mèo[/hi].,This is the Catkind secret weapon... [hi c=red]Boss Cat[/hi].
@TUTORIAL_BOSS_2,,"[hi c=red]Trùm Mèo[/hi] có sức mạnh vượt trội hơn đồng bọn Mèo khác của chúng, nên hãy cẩn thận!","[hi c=red]Boss Cat[/hi] has immense power compare to their comrades, so be careful!"
@TUTORIAL_BOSS_3,,Chúc may mắn.,Good luck.
,,...,...
@TUTORIAL_RUSH_1,,Đây là lãnh thổ khá là đặt biệt mà bọn Mèo chiếm đóng.,This area right here is quite a special place that the Catkind has taken over.
@TUTORIAL_RUSH_2,,"Ở đây mọc nhiều cỏ thuộc loại có tên là [hi]Bạc hà Mèo[/hi], nhiều nguồn tin thu được từ tình báo viên của chúng tôi cho rằng đây là một trong những lí do chính mà bọn Mèo đến xâm chiếm hành tinh này: Khai thác tài nguyên Bạc hà Mèo.","Here is home to a certain type of weed call [hi]Catnip[/hi], many sources from our Intelligence seems to conclude that this one of the reason why they invade our homeland: To extract this Catnip resource."
@TUTORIAL_RUSH_3,,"Cho nên hãy cẩn thận, khu vực này ắc hẳn chứa nhiều Mèo, và bọn chúng cũng ắc hẳn khá là điên á.","So keep your guard up! This area must be full of Cats, and those Cat must also be crazy as well."
@TUTORIAL_FINAL_BOSS_1,,[wave]Cuối cùng[/wave] thì loài Chó chúng tôi cũng đã đặt chân được đến đây một lần nữa...,"[wave]Finally[/wave], us Dogkind is able to set paw to this land once more..."
@TUTORIAL_FINAL_BOSS_2,,Đây là nơi đàu tiên mà loài Mèo xâm chiếm hành tinh Doggo của bọn tôi.,This is where the Catkind first invaded our planet Doggo.
@TUTORIAL_FINAL_BOSS_3,,Tôi hi vọng bạn có thể đánh đuổi được bọn chúng ra khỏi đây. Nhưng...,I really hope you can beat them out of this place. But...
@TUTORIAL_FINAL_BOSS_4,,Bạn cần phải biết điều này: Đây cũng chính là hang ổ của [hi c=red]Chúa Mèo[/hi]... Hắn chính là kẻ nắm lĩnh đội quân Mèo đi xâm chiếm hành tinh này.,You have to know that: This place is also the lair of the of [hi c=red]God Cat[/hi]... It is the being that controls the Cat army invading this planet.
@TUTORIAL_FINAL_BOSS_5,,Không đếm xuể bao nhiêu chú Chó đã bị thiêu đốt thành tro dưới Ngọn lửa Địa ngục của hắn.,Uncountable amount of Dogs has been reduced to ashes by it's Hell Fire.
@TUTORIAL_FINAL_BOSS_6,,"Không biết bao nhiêu chú Chó hằng đêm không ngủ được, hằng ngày không sống được bởi sự hiện diện che bóng ánh Mặt trời của hắn.","Many Dogs every night, unable to sleep, every day unable to live because of it's present that blocks even the Sun and it's sunlight."
@TUTORIAL_FINAL_BOSS_7,,"Làm ơn, hãy giúp bọn tôi dành lại lãnh thổ này.","Please, help us take back our land."
@TUTORIAL_FINAL_BOSS_8,,Giải phóng chúng tôi và tiêu diệt Sử giả của Địa ngục: [hi c=red]Chúa Mèo Ramiel[/hi].,Liberate us and kill Hell's Messenger: [c=red]God Cat Ramiel[/hi].
@TUTORIAL_FINAL_BOSS_9,,Bọn tôi đặt niềm tin vào bạn.,We put our trust in you.
@INTRO_SHRINE_MAIDEN_1,3,"Tại hành tinh Doggo, một biến cố bất ngờ đã xảy ra...","On planet Doggo, an unexpected incident has occurred..."
@INTRO_SHRINE_MAIDEN_2,"2,2,2.5","Một hồ nước có tên là Xuân Gâu bỗng dưng xuất hiện một ngôi đền,
Nó nằm ngay trên mặt hồ
Và cách căn cứ Chó một khoảng không quá xa","Out of the blue appeared a shrine, 
Floating on top of a lake called Springbark
It is not too faraway from the Dogbase"
@INTRO_SHRINE_MAIDEN_3,3.5,"Tò mò về sự việc này, loài Chó quyết định đi đến hồ nước để tìm hiểu.","Curious about this news, the Dogkind decided to march closer to the lake and investigate."
@INTRO_SHRINE_MAIDEN_4,"2,7","Từ ngoài xa, họ nhìn thấy dáng của một chú Chó
Với hi vọng rằng chú Chó này là một nhân tài có thể giúp đánh đuổi bọn Mèo, loài Chó càng tự tin bước đến ngôi đền.","From afar, they saw a figure of a Dog
With a hope that this Dog might just be the one who can defeat the Catkind, the Dogkind's spirits are heightened as they approach the shrine."
@INTRO_SHRINE_MAIDEN_5,0.75 LabelRed,Nhưng...,But...
@INTRO_SHRINE_MAIDEN_6,"5,4","Bất ngờ thay, họ phát hiện ra rằng loài Mèo đã đi trước họ một bước và đã xâm nhập vào trong ngôi đền
Một luồng ám khí len lỏi khắp không trung làm ô uế cả hồ nước.","Surprisingly, they discovered that the Cats are one step ahead of them and has already infiltrated the shrine
A stream of miasma pervades the atmosphere, contaminating the lake's surface."
