keys,vi,en
@SPEAKER_DOG_1,"Xương là tiền tệ quan trọng dùng để nâng cấp các chú Chó cứng của đội quân ta ngày càng mạnh hơn, ngoài ra cũng có thể dùng để nâng cấp kỹ năng và nội tại.","Bone is an important currency used to upgrade your beloved Dogs so that our army becomes stronger and stronger, can also be used to upgrade skills and passives."
@SPEAKER_DOG_2,"Thức ăn cho Chó là tài nguyên rất quý hiếm. Dùng nó, ta có thể chiêu mộ các loài Chó khác vào đội quân của chúng ta.","Dog Food is a rare resource. With them, you can summon special Dogs from around the world into our army."
@SPEAKER_DOG_3,"Muốn tiến quân đến thành của kẻ địch, việc có Chó đỡ đòn để bảo vệ các loài Chó khác tấn công từ xa là rất quan trọng.","To be able to march to the enemy's tower, having Dogs with defender role to protect other Dogs attacking from afar is very important."
@SPEAKER_DOG_4,Gâu gâu gâu!,Woof woof woof!
@SPEAKER_DOG_5,"Một số màn chơi sẽ có boss, cho nên hãy cẩn thận chuẩn bị đội hình thật vững trước khi bắt đầu công phá thành.","Some stages with have bosses, so be careful and prepare your team before deciding to march to the Cat Tower."
@SPEAKER_DOG_6,"Kỹ năng có thể giúp bạn lật ngược tình thế nếu sử dụng đúng cách, và tuyệt với nhất là chúng không tốn tiền khi sử dụng!","Skills can help you win an unbeatable battle if you know how to use them correctly. And best of all, they don't cost you a dime!"
@SPEAKER_DOG_7,"Muốn tiền tăng nhanh hơn khi ở trong trận đấu? Hãy nâng cấp nội tại ""Năng suất lao động""!","Want faster money rate in battle? Upgrade the ""Workforce Productivity"" passive!"
@SPEAKER_DOG_8,"Hãy nhớ nâng cấp những chú Chó của bạn, nâng cấp sẽ khiến chúng trở nên mạnh mẽ hơn!","Remember to upgrade your Dogs, upgrading them will make them stronger!"
@SPEAKER_DOG_9,"Loài Mèo đã đến đây và xâm chiếm hành tinh Doggo của chúng tôi, loài Chó chúng tôi nhất quyết sẽ không tha cho bọn chúng!!!","The Catkind had come and invaded our planet Doggo, we Dogkind will not forgive them!!!"